{
  "schema_version": "1.0.0",
  "record_type": "outlook",
  "id": "track-telomerase-restoration-outlook",
  "name": "Telomerase Restoration Track Outlook",
  "subject_type": "track",
  "subject_id": "telomerase-restoration",
  "evidence_stage": "human_biomarker_signal",
  "momentum": "mixed",
  "confidence": "low",
  "main_evidence_gaps": [
    "Human evidence is still biomarker-heavy: telomere length, immune subsets, and inflammation markers, not durable functional, disease, or survival outcomes.",
    "Therapeutic telomerase activation has an intrinsic proliferation and cancer-risk concern that is not resolved by short or small human studies.",
    "Human gene-therapy evidence for aging remains registry-level only; the identified AAV-hTERT aging study has unknown status and no posted results.",
    "Commercial conflicts, small samples, and a non-monotonic TA-65 dose signal limit how much weight to put on the strongest human telomere-length trial.",
    "A claimed CMV-vector TERT mouse lifespan result is now retracted and should not be used as positive support."
  ],
  "strongest_current_evidence": [
    "AAV9-mTERT treatment in adult and old mice increased median lifespan and improved several health and fitness markers without an observed cancer increase in that study.",
    "A one-year randomized human TA-65 study reported increased leukocyte telomere length at the lower dose.",
    "A post-myocardial-infarction TA-65 pilot RCT reported higher lymphocyte counts and lower hsCRP, although its predefined CD8+ TEMRA endpoint was null.",
    "Inducible telomerase reactivation in telomerase-deficient mice reversed severe telomere-dysfunction phenotypes, supporting the biology but not direct human translation."
  ],
  "interpretation_note": "Telomerase restoration deserves a first public baseline at human biomarker signal. The animal case is unusually direct for a hallmark track, and human TA-65 trials reach telomere or immune biomarker endpoints. The rating should not move beyond biomarker signal because human benefit, durability, gene-therapy safety, and cancer-risk boundaries remain unresolved.",
  "what_would_change_the_rating": [
    "A stronger stage assignment would need replicated human studies showing functional or clinical benefit tied to telomerase or telomere restoration, not only leukocyte telomere or immune-subset shifts.",
    "A gene-therapy upgrade would require transparent human safety data with telomerase activity, telomere-length, clonal expansion, and cancer-surveillance follow-up.",
    "A firmer read would need independent TA-65 or other activator trials with prespecified telomere biology endpoints, clearer dose-response behavior, and limited commercial conflicts.",
    "The rating would weaken if follow-up TA-65 trials fail biomarker replication, if telomerase activation produces concerning clonal or cancer signals, or if additional gene-therapy evidence is withdrawn or not reproducible."
  ],
  "earliest_plausible_window": "No credible LEV-relevant window can be assigned before replicated human functional benefit and long-term safety evidence exist.",
  "supporting_finding_ids": [
    "aav9-mtert-extended-lifespan-adult-old-mice",
    "tert-reactivation-reversed-degeneration-telomerase-deficient-mice",
    "ta65-mouse-short-telomere-healthspan-signal",
    "ta65-low-dose-increased-human-telomere-length",
    "ta65-health-maintenance-short-telomere-immune-signal",
    "ta65-post-mi-immune-biomarkers-mixed",
    "tat2-ex-vivo-cd8-antiviral-function-positive",
    "libella-aav-htert-registry-no-results",
    "cmv-tert-lifespan-paper-retracted"
  ],
  "supporting_evidence": [
    {
      "label": "Stage assignment",
      "outlook_field": "evidence_stage",
      "conclusion": "The track reaches human biomarker signal because randomized human TA-65 studies report leukocyte telomere-length or immune/inflammation biomarker changes.",
      "support_role": "supports",
      "rationale": "The 2016 TA-65 RCT directly measured telomere length, and the 2023 post-MI trial measured immune-aging and inflammation biomarkers. These are human signals, but they do not establish functional benefit.",
      "finding_ids": [
        "ta65-low-dose-increased-human-telomere-length",
        "ta65-post-mi-immune-biomarkers-mixed"
      ],
      "source_ids": [
        "pmid-26950204",
        "pmid-37086366"
      ],
      "limitations": [
        "The strongest direct telomere endpoint is a biomarker endpoint.",
        "The post-MI trial missed its predefined primary CD8+ TEMRA endpoint.",
        "Neither trial establishes durable disease, mortality, or broad healthy-aging benefit."
      ]
    },
    {
      "label": "Animal plausibility",
      "outlook_field": "strongest_current_evidence",
      "conclusion": "Animal data make telomerase restoration biologically coherent and include lifespan benefit in adult and old mice.",
      "support_role": "supports",
      "rationale": "AAV9-mTERT improved median lifespan in mice, while inducible TERT reactivation reversed severe telomere-dysfunction phenotypes in a genetic model.",
      "finding_ids": [
        "aav9-mtert-extended-lifespan-adult-old-mice",
        "tert-reactivation-reversed-degeneration-telomerase-deficient-mice",
        "ta65-mouse-short-telomere-healthspan-signal"
      ],
      "source_ids": [
        "pmid-22585399",
        "pmid-21113150",
        "pmid-21426483"
      ],
      "limitations": [
        "Mouse lifespan and rescue models do not settle human efficacy or safety.",
        "Severe telomerase-deficient mouse models overstate the degree of telomere dysfunction typical of normal human aging.",
        "Gene-delivery and cancer-risk translation remain open."
      ]
    },
    {
      "label": "Human activator boundary",
      "outlook_field": "confidence",
      "conclusion": "TA-65 human evidence is enough for a biomarker baseline but not enough for a confident clinical claim.",
      "support_role": "limits",
      "rationale": "The controlled telomere-length result has commercial conflicts and a non-monotonic dose pattern; the uncontrolled health-maintenance program is confounded; the post-MI study is mixed.",
      "finding_ids": [
        "ta65-low-dose-increased-human-telomere-length",
        "ta65-health-maintenance-short-telomere-immune-signal",
        "ta65-post-mi-immune-biomarkers-mixed"
      ],
      "source_ids": [
        "pmid-26950204",
        "pmid-20822369",
        "pmid-37086366"
      ],
      "limitations": [
        "Some authors in the telomere-length trial were employees or consultants of T.A. Sciences.",
        "The uncontrolled program cannot isolate TA-65 from supplements, counseling, and monitoring.",
        "Positive secondary biomarkers in the post-MI trial do not override the null primary endpoint."
      ]
    },
    {
      "label": "Gene-therapy boundary",
      "outlook_field": "main_evidence_gaps",
      "conclusion": "Human telomerase gene-therapy activity remains too thin to support benefit or safety claims.",
      "support_role": "limits",
      "rationale": "The identified AAV-hTERT aging registry study is tiny, single-arm, listed with unknown status, and lacks posted results.",
      "finding_ids": [
        "libella-aav-htert-registry-no-results"
      ],
      "source_ids": [
        "nct-04133649"
      ],
      "limitations": [
        "No human results are posted.",
        "Estimated enrollment was only five participants.",
        "A single-arm safety study would not establish efficacy even if completed."
      ]
    },
    {
      "label": "Publication-integrity boundary",
      "outlook_field": "momentum",
      "conclusion": "Momentum is mixed partly because a prominent CMV-vector TERT mouse life-extension paper has been retracted.",
      "support_role": "limits",
      "rationale": "The retraction prevents use of that paper as positive gene-therapy evidence and reinforces the need for reproducibility.",
      "finding_ids": [
        "cmv-tert-lifespan-paper-retracted"
      ],
      "source_ids": [
        "pmid-40789040"
      ],
      "limitations": [
        "The retraction notice is a publication-status event, not a biological experiment.",
        "Other animal TERT evidence remains in the baseline but should not be conflated with the retracted CMV-vector report."
      ]
    },
    {
      "label": "Read firmness",
      "outlook_field": "confidence",
      "conclusion": "The read remains tentative because evidence is heterogeneous and human data do not yet show durable function, disease, or survival benefit.",
      "support_role": "balances",
      "rationale": "The track has direct hallmark biology and human biomarkers, but the same evidence set has meaningful safety, conflict-of-interest, dose-response, publication-integrity, and translation limitations.",
      "finding_ids": [
        "aav9-mtert-extended-lifespan-adult-old-mice",
        "ta65-low-dose-increased-human-telomere-length",
        "ta65-post-mi-immune-biomarkers-mixed",
        "libella-aav-htert-registry-no-results",
        "cmv-tert-lifespan-paper-retracted"
      ],
      "source_ids": [
        "pmid-22585399",
        "pmid-26950204",
        "pmid-37086366",
        "nct-04133649",
        "pmid-40789040"
      ],
      "limitations": [
        "No cited human study demonstrates LEV-relevant clinical benefit.",
        "Long-term telomerase activation safety is not resolved.",
        "The most ambitious human gene-therapy claim remains unsupported by posted clinical results."
      ]
    }
  ],
  "supporting_source_ids": [
    "pmid-21113150",
    "pmid-22585399",
    "pmid-21426483",
    "pmid-26950204",
    "pmid-20822369",
    "pmid-37086366",
    "pmid-18981163",
    "nct-04133649",
    "pmid-40789040"
  ],
  "last_updated": "2026-05-31",
  "tags": [
    "public",
    "track",
    "thin_coverage"
  ]
}
