{
  "schema_version": "1.0.0",
  "record_type": "outlook",
  "id": "track-extracellular-vesicle-and-secretome-therapies-outlook",
  "name": "Extracellular Vesicle and Secretome Therapies Track Outlook",
  "subject_type": "track",
  "subject_id": "extracellular-vesicle-and-secretome-therapies",
  "evidence_stage": "human_biomarker_signal",
  "momentum": "accelerating",
  "confidence": "low",
  "main_evidence_gaps": [
    "The most direct aging and healthspan evidence remains animal evidence from MSC-derived EV and conditioned-medium studies.",
    "Human aging-relevant signals are concentrated in short dermatology studies using skin appearance, wrinkle, pigmentation, hydration, or histology endpoints rather than systemic function.",
    "Disease-specific human trials in Alzheimer's disease, osteoarthritis, and wound healing are small, uncontrolled, null, or designed mainly for safety.",
    "EV and secretome products are heterogeneous across donor source, cell source, culture conditions, isolation method, cargo, dose, route, and adjunct procedures such as microneedling.",
    "Commercial exosome and secretome claims can outrun the controlled evidence; product characterization, potency assays, durability, and long-term safety remain central blockers."
  ],
  "strongest_current_evidence": [
    "Human split-face and meta-analytic dermatology evidence suggests stem-cell conditioned media or exosome-containing solutions can move skin-aging appearance and instrumented biomarker endpoints.",
    "MSC-derived extracellular vesicles reduce senescence markers and improve lifespan or healthspan readouts in mouse aging models.",
    "Early human disease trials show feasibility and tolerability, but the most controlled osteoarthritis and wound-healing evidence is null for functional benefit."
  ],
  "interpretation_note": "Extracellular vesicle and secretome therapies merit a low-confidence human_biomarker_signal baseline. Human evidence has crossed into controlled skin-aging biomarker studies, while the strongest direct aging biology is still mouse-based and disease-specific human functional claims remain either uncontrolled, mixed, or null. The track should not be upgraded to human_functional_benefit until characterized products show replicated functional, intrinsic-capacity, disease, or durability benefits in aging-relevant populations.",
  "what_would_change_the_rating": [
    "A functional-benefit upgrade would require randomized controlled human studies with prespecified physical, cognitive, wound-healing, tissue-function, intrinsic-capacity, or disease-progression endpoints beyond cosmetic skin measures.",
    "Higher confidence at the biomarker stage would require independent replication with standardized EV or secretome characterization, potency assays, dose, route, and durability follow-up.",
    "The rating would weaken if placebo-controlled EV trials continue to show null functional or imaging outcomes while uncontrolled studies remain the main positive evidence.",
    "Preclinical healthspan claims should not upgrade the track unless human trials link product-defined EV or secretome cargo to target engagement and clinically meaningful outcomes."
  ],
  "earliest_plausible_window": "No credible LEV-relevant window can be assigned before replicated human functional benefit and standardized product characterization are available.",
  "supporting_finding_ids": [
    "hesc-conditioned-medium-improved-human-skin-aging",
    "conditioned-medium-meta-analysis-supported-skin-aging",
    "adipose-exosome-solution-improved-skin-aging",
    "msc-evs-extended-healthspan-mouse-aging",
    "adipose-msc-exosomes-ad-safety-exploratory-cognition",
    "placental-msc-evs-null-knee-oa-rct",
    "huc-msc-exosomes-oa-pilot-dose-signal",
    "platelet-evs-safe-no-wound-closure-advantage"
  ],
  "supporting_evidence": [
    {
      "label": "Stage assignment",
      "outlook_field": "evidence_stage",
      "conclusion": "The track reaches human_biomarker_signal because controlled human skin-aging studies and a meta-analysis report movement in appearance and instrumented skin endpoints.",
      "support_role": "supports",
      "rationale": "The human evidence directly tests secretome or exosome-containing products in aging-relevant skin endpoints, but these endpoints remain local biomarkers and aesthetic measures rather than systemic function.",
      "finding_ids": [
        "hesc-conditioned-medium-improved-human-skin-aging",
        "conditioned-medium-meta-analysis-supported-skin-aging",
        "adipose-exosome-solution-improved-skin-aging"
      ],
      "source_ids": [
        "pmid-25324650",
        "pmid-36396862",
        "pmid-37377400"
      ],
      "limitations": [
        "Skin appearance and instrumented skin measures are not broad healthspan or LEV outcomes.",
        "Most studies combine the product with microneedling or resurfacing.",
        "Conditioned media and exosome-containing solutions may not isolate EV-specific mechanisms."
      ]
    },
    {
      "label": "Direct aging biology",
      "outlook_field": "strongest_current_evidence",
      "conclusion": "MSC-derived EVs provide direct preclinical aging support through senescence, lifespan, and healthspan readouts.",
      "support_role": "supports",
      "rationale": "The mouse aging study is closer to the track's LEV rationale than most disease trials, because it directly tests senescence and healthspan-related outcomes after EV or secretome intervention.",
      "finding_ids": [
        "msc-evs-extended-healthspan-mouse-aging"
      ],
      "source_ids": [
        "pmid-33728821"
      ],
      "limitations": [
        "The evidence is preclinical.",
        "The lifespan signal includes progeroid Ercc1-deficient mice.",
        "Mouse healthspan effects do not establish human dosing, durability, or safety."
      ]
    },
    {
      "label": "Disease-specific human boundary",
      "outlook_field": "main_evidence_gaps",
      "conclusion": "Human disease-function evidence remains insufficient for a broad functional-benefit rating.",
      "support_role": "limits",
      "rationale": "The Alzheimer's trial was open-label and tiny, one osteoarthritis study was an uncontrolled dose pilot, and the strongest placebo-controlled osteoarthritis trial was null.",
      "finding_ids": [
        "adipose-msc-exosomes-ad-safety-exploratory-cognition",
        "placental-msc-evs-null-knee-oa-rct",
        "huc-msc-exosomes-oa-pilot-dose-signal"
      ],
      "source_ids": [
        "pmid-37859748",
        "pmid-39465400",
        "pmid-40500748"
      ],
      "limitations": [
        "Alzheimer's disease, knee osteoarthritis, and wound healing are disease-specific or injury-specific contexts.",
        "The positive human signals are not replicated placebo-controlled aging-function evidence.",
        "The placebo-controlled osteoarthritis trial argues against treating early functional signals as established efficacy."
      ]
    },
    {
      "label": "Human safety and manufacturing feasibility",
      "outlook_field": "strongest_current_evidence",
      "conclusion": "A first-in-human platelet-EV trial supports early tolerability but not wound-healing efficacy.",
      "support_role": "balances",
      "rationale": "The platelet-EV phase I study shows GMP-oriented EV production and paired human dosing feasibility, while the within-person closure result was equivalent to placebo.",
      "finding_ids": [
        "platelet-evs-safe-no-wound-closure-advantage"
      ],
      "source_ids": [
        "pmid-37353884"
      ],
      "limitations": [
        "The study enrolled healthy volunteers with acute punch-biopsy wounds.",
        "It was primarily a safety study and was not powered for delayed-wound efficacy.",
        "No closure-time advantage was observed."
      ]
    },
    {
      "label": "Momentum and confidence",
      "outlook_field": "confidence",
      "conclusion": "Momentum is accelerating but confidence remains low because positive human signals are local, small, or uncontrolled and the product class is heterogeneous.",
      "support_role": "balances",
      "rationale": "Recent human publications span skin aging, Alzheimer's disease, wound healing, and osteoarthritis, but the evidence mix does not yet establish durable functional benefit for broad aging.",
      "finding_ids": [
        "conditioned-medium-meta-analysis-supported-skin-aging",
        "adipose-exosome-solution-improved-skin-aging",
        "adipose-msc-exosomes-ad-safety-exploratory-cognition",
        "placental-msc-evs-null-knee-oa-rct",
        "platelet-evs-safe-no-wound-closure-advantage"
      ],
      "source_ids": [
        "pmid-36396862",
        "pmid-37377400",
        "pmid-37859748",
        "pmid-39465400",
        "pmid-37353884"
      ],
      "limitations": [
        "No staged source demonstrates durable disease prevention, mortality benefit, or healthy-lifespan extension in humans.",
        "Standardized potency and product-comparability evidence is still thin.",
        "The baseline should not be generalized to commercial uncharacterized exosome products."
      ]
    }
  ],
  "supporting_source_ids": [
    "pmid-25324650",
    "pmid-36396862",
    "pmid-37377400",
    "pmid-33728821",
    "pmid-37859748",
    "pmid-39465400",
    "pmid-40500748",
    "pmid-37353884"
  ],
  "last_updated": "2026-06-01",
  "tags": [
    "public",
    "track",
    "thin_coverage"
  ]
}
