{
  "schema_version": "1.0.0",
  "record_type": "outlook",
  "id": "hallmark-telomere-attrition-outlook",
  "name": "Telomere Attrition Outlook",
  "subject_type": "hallmark",
  "subject_id": "telomere_attrition",
  "evidence_stage": "animal_signal",
  "momentum": "uncertain",
  "confidence": "low",
  "main_evidence_gaps": [
    "Human relevance is still constrained by safety, durability, and narrow endpoint selection."
  ],
  "strongest_current_evidence": [
    "Telomerase restoration remains one of the clearest hallmark-specific intervention ideas."
  ],
  "interpretation_note": "This area stays conceptually important, but evidence still looks thin relative to the ambition of the claims often made around it.",
  "last_updated": "2026-05-18",
  "tags": [
    "public",
    "thin_coverage"
  ]
}
